<?xml version="1.0" encoding="UTF-8"?>
<root>
    <row>
        <identifier>HikingClub_photos_0021</identifier>
        <title>Eating Lunch on Mt. Harrison Feb 4-5-1928 (image number 37)</title>
        <date_text>2/4-5/1928</date_text>
        <date_single_start>1928-02-04</date_single_start>
        <date_range_end>1928-02-05</date_range_end>
        <collection>Smoky Mountains Hiking Club Records</collection>
        <collection_identifier>MS.0423</collection_identifier>
        <shelf_locator>Box 1</shelf_locator>
        <extent>3.5 x 5.75 inches</extent>
        <form>photographs | http://vocab.getty.edu/aat/300046300</form>
        <language>eng</language>
        <subject_geographic>Great Smoky Mountains | URI: http://id.loc.gov/authorities/subjects/sh85057008 | Coordinates: 35.58343, -83.50822</subject_geographic>
        <subject_geographic>Harrison, Mount (Tenn.) | Coordinates: 35.69676, -83.57267</subject_geographic>
        <subject_name>Smoky Mountains Hiking Club</subject_name>
        <subject_name>Roth, Albert, 1890-1974 | http://id.loc.gov/authorities/names/n2004050214</subject_name>
        <project_title>Smoky Mountains Hiking Club Handbooks</project_title>
        <repository>University of Tennessee, Knoxville. Special Collections</repository>
        <rights>The copyright interests in this item remain with the creator. For more information, contact Special Collections at special@utk.edu.</rights>
        <public_note>Title is from information on back of photograph.</public_note>
        <public_note>Collection donated by Laura E. and Ella Luttrell</public_note>
        <digital_origin>reformatted digital</digital_origin>
        <item_type>still image</item_type>
    </row>
    <row>
        <identifier>HikingClub_photos_0027</identifier>
        <title>At Neubert Spring instead of Cherokee Bluff May 20-1928 (image number 99)</title>
        <date_text>5/20/1928</date_text>
        <date_single_start>1928-05-20</date_single_start>
        <collection>Smoky Mountains Hiking Club Records</collection>
        <collection_identifier>MS.0423</collection_identifier>
        <shelf_locator>Box 1</shelf_locator>
        <extent>3.5 x 5.75 inches</extent>
        <form>photographs | http://vocab.getty.edu/aat/300046300</form>
        <language>eng</language>
        <subject_geographic>Great Smoky Mountains | URI: http://id.loc.gov/authorities/subjects/sh85057008 | Coordinates: 35.58343, -83.50822</subject_geographic>
        <subject_geographic>Neubert Springs (Tenn.) | Coordinates: 35.87925, -83.87435</subject_geographic>
        <subject_name>Smoky Mountains Hiking Club</subject_name>
        <subject_name>Roth, Albert, 1890-1974 | http://id.loc.gov/authorities/names/n2004050214</subject_name>
        <project_title>Smoky Mountains Hiking Club Handbooks</project_title>
        <repository>University of Tennessee, Knoxville. Special Collections</repository>
        <rights>The copyright interests in this item remain with the creator. For more information, contact Special Collections at special@utk.edu.</rights>
        <public_note>Title is from information on back of photograph.</public_note>
        <public_note>Collection donated by Laura E. and Ella Luttrell</public_note>
        <digital_origin>reformatted digital</digital_origin>
        <item_type>still image</item_type>
    </row>
    <row>
        <identifier>HikingClub_photos_0040</identifier>
        <title>Cascades on way to Guyot Aug 31 - Sept 1-2-1929 (image number 338)</title>
        <date_text>8/31-9/1-2/1929</date_text>
        <date_single_start>1929-08-31</date_single_start>
        <date_range_end>1929-09-02</date_range_end>
        <collection>Smoky Mountains Hiking Club Records</collection>
        <collection_identifier>MS.0423</collection_identifier>
        <shelf_locator>Box 1</shelf_locator>
        <extent>3.5 x 5.75 inches</extent>
        <form>photographs | http://vocab.getty.edu/aat/300046300</form>
        <language>eng</language>
        <subject_geographic>Great Smoky Mountains | URI: http://id.loc.gov/authorities/subjects/sh85057008 | Coordinates: 35.58343, -83.50822</subject_geographic>
        <subject_geographic>Guyot, Mount (Tenn.) | Coordinates: 35.705, -83.2575</subject_geographic>
        <subject_geographic>Ramsey Prong (Tenn.) | Coordinates: 35.70287, -83.33349</subject_geographic>
        <subject_name>Smoky Mountains Hiking Club</subject_name>
        <subject_name>Roth, Albert, 1890-1974 | http://id.loc.gov/authorities/names/n2004050214</subject_name>
        <project_title>Smoky Mountains Hiking Club Handbooks</project_title>
        <repository>University of Tennessee, Knoxville. Special Collections</repository>
        <rights>The copyright interests in this item remain with the creator. For more information, contact Special Collections at special@utk.edu.</rights>
        <public_note>Title is from information on back of photograph.</public_note>
        <public_note>Collection donated by Laura E. and Ella Luttrell</public_note>
        <digital_origin>reformatted digital</digital_origin>
        <item_type>still image</item_type>
    </row>
    <row>
        <identifier>HikingClub_photos_0051</identifier>
        <title>Indian Gap Hotel &amp; Chimneys Jan 12-1930 (image number 402)</title>
        <date_text>1/12/1930</date_text>
        <date_single_start>1930-01-12</date_single_start>
        <collection>Smoky Mountains Hiking Club Records</collection>
        <collection_identifier>MS.0423</collection_identifier>
        <shelf_locator>Box 1</shelf_locator>
        <extent>3.5 x 5.75 inches</extent>
        <form>photographs | http://vocab.getty.edu/aat/300046300</form>
        <language>eng</language>
        <subject_geographic>Great Smoky Mountains | URI: http://id.loc.gov/authorities/subjects/sh85057008 | Coordinates: 35.58343, -83.50822</subject_geographic>
        <subject_geographic>Chimney Tops (Tenn.) | Coordinates: 35.62999, -83.47803</subject_geographic>
        <subject_geographic>Indian Gap Hotel</subject_geographic>
        <subject_name>Smoky Mountains Hiking Club</subject_name>
        <subject_name>Roth, Albert, 1890-1974 | http://id.loc.gov/authorities/names/n2004050214</subject_name>
        <project_title>Smoky Mountains Hiking Club Handbooks</project_title>
        <repository>University of Tennessee, Knoxville. Special Collections</repository>
        <rights>The copyright interests in this item remain with the creator. For more information, contact Special Collections at special@utk.edu.</rights>
        <public_note>Title is from information on back of photograph.</public_note>
        <public_note>Collection donated by Laura E. and Ella Luttrell</public_note>
        <digital_origin>reformatted digital</digital_origin>
        <item_type>still image</item_type>
    </row>
    <row>
        <identifier>HikingClub_photos_0082</identifier>
        <title>On top of Thunderhead or Laurel Top April 11-12-1931 (image number 717)</title>
        <date_text>4/11-12/1931</date_text>
        <date_single_start>1931-04-11</date_single_start>
        <date_range_end>1931-04-12</date_range_end>
        <collection>Smoky Mountains Hiking Club Records</collection>
        <collection_identifier>MS.0423</collection_identifier>
        <shelf_locator>Box 1</shelf_locator>
        <extent>3.5 x 5.75 inches</extent>
        <form>photographs | http://vocab.getty.edu/aat/300046300</form>
        <language>eng</language>
        <subject_geographic>Great Smoky Mountains | URI: http://id.loc.gov/authorities/subjects/sh85057008 | Coordinates: 35.58343, -83.50822</subject_geographic>
        <subject_geographic>Thunderhead Mountain (Tenn.) | Coordinates: 35.5687, -83.70628</subject_geographic>
        <subject_name>Smoky Mountains Hiking Club</subject_name>
        <subject_name>Roth, Albert, 1890-1974 | http://id.loc.gov/authorities/names/n2004050214</subject_name>
        <project_title>Smoky Mountains Hiking Club Handbooks</project_title>
        <repository>University of Tennessee, Knoxville. Special Collections</repository>
        <rights>The copyright interests in this item remain with the creator. For more information, contact Special Collections at special@utk.edu.</rights>
        <public_note>Title is from information on back of photograph.</public_note>
        <public_note>Collection donated by Laura E. and Ella Luttrell</public_note>
        <digital_origin>reformatted digital</digital_origin>
        <item_type>still image</item_type>
    </row>
    <row>
        <identifier>HikingClub_photos_0085</identifier>
        <title>On Myrtle Point on away across Huggins Hell May 2-3-1931 (image number 735)</title>
        <date_text>5/2-3/1931</date_text>
        <date_single_start>1931-05-02</date_single_start>
        <date_range_end>1931-05-03</date_range_end>
        <collection>Smoky Mountains Hiking Club Records</collection>
        <collection_identifier>MS.0423</collection_identifier>
        <shelf_locator>Box 1</shelf_locator>
        <extent>3.5 x 5.75 inches</extent>
        <form>photographs | http://vocab.getty.edu/aat/300046300</form>
        <language>eng</language>
        <subject_geographic>Great Smoky Mountains | URI: http://id.loc.gov/authorities/subjects/sh85057008 | Coordinates: 35.58343, -83.50822</subject_geographic>
        <subject_geographic>Myrtle Point (Tenn.) | Coordinates: 35.65371, -83.43155</subject_geographic>
        <subject_geographic>Huggins Hell (Tenn.) | Coordinates: 35.64093, -83.43627</subject_geographic>
        <subject_geographic>LeConte, Mount (Tenn.) | URI: http://id.loc.gov/authorities/subjects/sh86006260 | Coordinates: 35.65426, -83.43683</subject_geographic>
        <subject_name>Smoky Mountains Hiking Club</subject_name>
        <subject_name>Roth, Albert, 1890-1974 | http://id.loc.gov/authorities/names/n2004050214</subject_name>
        <project_title>Smoky Mountains Hiking Club Handbooks</project_title>
        <repository>University of Tennessee, Knoxville. Special Collections</repository>
        <rights>The copyright interests in this item remain with the creator. For more information, contact Special Collections at special@utk.edu.</rights>
        <public_note>Title is from information on back of photograph.</public_note>
        <public_note>Collection donated by Laura E. and Ella Luttrell</public_note>
        <digital_origin>reformatted digital</digital_origin>
        <item_type>still image</item_type>
    </row>
    <row>
        <identifier>HikingClub_photos_0008</identifier>
        <title>Club on top of Look Rock on way to Abrams Falls Jan 7-8-1928 (image number 32]</title>
        <abstract>Jim Thompson, 6th from the left</abstract>
        <date_text>1/8/1928</date_text>
        <date_single_start>1928-01-08</date_single_start>
        <collection>Smoky Mountains Hiking Club Records</collection>
        <collection_identifier>MS.0423</collection_identifier>
        <shelf_locator>Box 1</shelf_locator>
        <extent>3.5 x 5.75 inches</extent>
        <form>photographs | http://vocab.getty.edu/aat/300046300</form>
        <language>eng</language>
        <subject_geographic>Great Smoky Mountains | URI: http://id.loc.gov/authorities/subjects/sh85057008 | Coordinates: 35.58343, -83.50822</subject_geographic>
        <subject_geographic>Look Rock (Tenn.) | Coordinates: 35.63314, -83.94185</subject_geographic>
        <subject_name>Smoky Mountains Hiking Club</subject_name>
        <subject_name>Thompson, Jim</subject_name>
        <project_title>Smoky Mountains Hiking Club Handbooks</project_title>
        <repository>University of Tennessee, Knoxville. Special Collections</repository>
        <rights>The copyright interests in this item remain with the creator. For more information, contact Special Collections at special@utk.edu.</rights>
        <public_note>Title is from information on back of photograph.</public_note>
        <public_note>Collection donated by Laura E. and Ella Luttrell</public_note>
        <digital_origin>reformatted digital</digital_origin>
        <item_type>still image</item_type>
    </row>
    <row>
        <identifier>HikingClub_photos_0001</identifier>
        <title>Hiker in the Smokies (image number 617)</title>
        <date_text>1928-1931</date_text>
        <date_single_start>1928</date_single_start>
        <date_range_end>1931</date_range_end>
        <collection>Smoky Mountains Hiking Club Records</collection>
        <collection_identifier>MS.0423</collection_identifier>
        <shelf_locator>Box 1</shelf_locator>
        <extent>3.5 x 5.75 inches</extent>
        <form>photographs | http://vocab.getty.edu/aat/300046300</form>
        <language>eng</language>
        <subject_geographic>Great Smoky Mountains | URI: http://id.loc.gov/authorities/subjects/sh85057008 | Coordinates: 35.58343, -83.50822</subject_geographic>
        <subject_name>Smoky Mountains Hiking Club</subject_name>
        <project_title>Smoky Mountains Hiking Club Handbooks</project_title>
        <repository>University of Tennessee, Knoxville. Special Collections</repository>
        <rights>The copyright interests in this item remain with the creator. For more information, contact Special Collections at special@utk.edu.</rights>
        <public_note>Title created from image details.</public_note>
        <public_note>Collection donated by Laura E. and Ella Luttrell</public_note>
        <digital_origin>reformatted digital</digital_origin>
        <item_type>still image</item_type>
    </row>
    <row>
        <identifier>HikingClub_photos_0002</identifier>
        <title>Distant View from the Smokies (image number 620)</title>
        <date_text>1928-1931</date_text>
        <date_single_start>1928</date_single_start>
        <date_range_end>1931</date_range_end>
        <collection>Smoky Mountains Hiking Club Records</collection>
        <collection_identifier>MS.0423</collection_identifier>
        <shelf_locator>Box 1</shelf_locator>
        <extent>3.5 x 5.75 inches</extent>
        <form>photographs | http://vocab.getty.edu/aat/300046300</form>
        <language>eng</language>
        <subject_geographic>Great Smoky Mountains | URI: http://id.loc.gov/authorities/subjects/sh85057008 | Coordinates: 35.58343, -83.50822</subject_geographic>
        <subject_name>Smoky Mountains Hiking Club</subject_name>
        <project_title>Smoky Mountains Hiking Club Handbooks</project_title>
        <repository>University of Tennessee, Knoxville. Special Collections</repository>
        <rights>The copyright interests in this item remain with the creator. For more information, contact Special Collections at special@utk.edu.</rights>
        <public_note>Title created from image details.</public_note>
        <public_note>Collection donated by Laura E. and Ella Luttrell</public_note>
        <digital_origin>reformatted digital</digital_origin>
        <item_type>still image</item_type>
    </row>
    <row>
        <identifier>HikingClub_photos_0003</identifier>
        <title>Distant View of the Smokies (image number 608)</title>
        <date_text>1928-1931</date_text>
        <date_single_start>1928</date_single_start>
        <date_range_end>1931</date_range_end>
        <collection>Smoky Mountains Hiking Club Records</collection>
        <collection_identifier>MS.0423</collection_identifier>
        <shelf_locator>Box 1</shelf_locator>
        <extent>3.5 x 5.75 inches</extent>
        <form>photographs | http://vocab.getty.edu/aat/300046300</form>
        <language>eng</language>
        <subject_geographic>Great Smoky Mountains | URI: http://id.loc.gov/authorities/subjects/sh85057008 | Coordinates: 35.58343, -83.50822</subject_geographic>
        <subject_name>Smoky Mountains Hiking Club</subject_name>
        <project_title>Smoky Mountains Hiking Club Handbooks</project_title>
        <repository>University of Tennessee, Knoxville. Special Collections</repository>
        <rights>The copyright interests in this item remain with the creator. For more information, contact Special Collections at special@utk.edu.</rights>
        <public_note>Title created from image details.</public_note>
        <public_note>Collection donated by Laura E. and Ella Luttrell</public_note>
        <digital_origin>reformatted digital</digital_origin>
        <item_type>still image</item_type>
    </row>
    <row>
        <identifier>HikingClub_photos_0004</identifier>
        <title>Barn with Peak in the Distance (image number 616)</title>
        <date_text>1928-1931</date_text>
        <date_single_start>1928</date_single_start>
        <date_range_end>1931</date_range_end>
        <collection>Smoky Mountains Hiking Club Records</collection>
        <collection_identifier>MS.0423</collection_identifier>
        <shelf_locator>Box 1</shelf_locator>
        <extent>3.5 x 5.75 inches</extent>
        <form>photographs | http://vocab.getty.edu/aat/300046300</form>
        <language>eng</language>
        <subject_geographic>Great Smoky Mountains | URI: http://id.loc.gov/authorities/subjects/sh85057008 | Coordinates: 35.58343, -83.50822</subject_geographic>
        <subject_name>Smoky Mountains Hiking Club</subject_name>
        <project_title>Smoky Mountains Hiking Club Handbooks</project_title>
        <repository>University of Tennessee, Knoxville. Special Collections</repository>
        <rights>The copyright interests in this item remain with the creator. For more information, contact Special Collections at special@utk.edu.</rights>
        <public_note>Title created from image details.</public_note>
        <public_note>Collection donated by Laura E. and Ella Luttrell</public_note>
        <digital_origin>reformatted digital</digital_origin>
        <item_type>still image</item_type>
    </row>
    <row>
        <identifier>HikingClub_photos_0005</identifier>
        <title>Train Derailment (image number 612)</title>
        <date_text>1928-1931</date_text>
        <date_single_start>1928</date_single_start>
        <date_range_end>1931</date_range_end>
        <collection>Smoky Mountains Hiking Club Records</collection>
        <collection_identifier>MS.0423</collection_identifier>
        <shelf_locator>Box 1</shelf_locator>
        <extent>3.5 x 5.75 inches</extent>
        <form>photographs | http://vocab.getty.edu/aat/300046300</form>
        <language>eng</language>
        <subject_geographic>Great Smoky Mountains | URI: http://id.loc.gov/authorities/subjects/sh85057008 | Coordinates: 35.58343, -83.50822</subject_geographic>
        <subject_name>Smoky Mountains Hiking Club</subject_name>
        <project_title>Smoky Mountains Hiking Club Handbooks</project_title>
        <repository>University of Tennessee, Knoxville. Special Collections</repository>
        <rights>The copyright interests in this item remain with the creator. For more information, contact Special Collections at special@utk.edu.</rights>
        <public_note>Title created from image details.</public_note>
        <public_note>Collection donated by Laura E. and Ella Luttrell</public_note>
        <digital_origin>reformatted digital</digital_origin>
        <item_type>still image</item_type>
    </row>
    <row>
        <identifier>HikingClub_photos_0006</identifier>
        <title>Smoky Mountains Hiking Club in Late Fall or Early Winter (image number 611)</title>
        <date_text>1928-1931</date_text>
        <date_single_start>1928</date_single_start>
        <date_range_end>1931</date_range_end>
        <collection>Smoky Mountains Hiking Club Records</collection>
        <collection_identifier>MS.0423</collection_identifier>
        <shelf_locator>Box 1</shelf_locator>
        <extent>3.5 x 5.75 inches</extent>
        <form>photographs | http://vocab.getty.edu/aat/300046300</form>
        <language>eng</language>
        <subject_geographic>Great Smoky Mountains | URI: http://id.loc.gov/authorities/subjects/sh85057008 | Coordinates: 35.58343, -83.50822</subject_geographic>
        <subject_name>Smoky Mountains Hiking Club</subject_name>
        <project_title>Smoky Mountains Hiking Club Handbooks</project_title>
        <repository>University of Tennessee, Knoxville. Special Collections</repository>
        <rights>The copyright interests in this item remain with the creator. For more information, contact Special Collections at special@utk.edu.</rights>
        <public_note>Title created from image details.</public_note>
        <public_note>Collection donated by Laura E. and Ella Luttrell</public_note>
        <digital_origin>reformatted digital</digital_origin>
        <item_type>still image</item_type>
    </row>
    <row>
        <identifier>HikingClub_photos_0007</identifier>
        <title>View of Chilhowee Mountain from the Smokies (image number 609)</title>
        <date_text>1928-1931</date_text>
        <date_single_start>1928</date_single_start>
        <date_range_end>1931</date_range_end>
        <collection>Smoky Mountains Hiking Club Records</collection>
        <collection_identifier>MS.0423</collection_identifier>
        <shelf_locator>Box 1</shelf_locator>
        <extent>3.5 x 5.75 inches</extent>
        <form>photographs | http://vocab.getty.edu/aat/300046300</form>
        <language>eng</language>
        <subject_geographic>Great Smoky Mountains | URI: http://id.loc.gov/authorities/subjects/sh85057008 | Coordinates: 35.58343, -83.50822</subject_geographic>
        <subject_name>Smoky Mountains Hiking Club</subject_name>
        <project_title>Smoky Mountains Hiking Club Handbooks</project_title>
        <repository>University of Tennessee, Knoxville. Special Collections</repository>
        <rights>The copyright interests in this item remain with the creator. For more information, contact Special Collections at special@utk.edu.</rights>
        <public_note>Title created from image details.</public_note>
        <public_note>Collection donated by Laura E. and Ella Luttrell</public_note>
        <digital_origin>reformatted digital</digital_origin>
        <item_type>still image</item_type>
    </row>
    <row>
        <identifier>HikingClub_photos_0009</identifier>
        <title>Abrams Falls Jan 7-8-1928 (image number 33)</title>
        <date_text>1/8/1928</date_text>
        <date_single_start>1928-01-08</date_single_start>
        <collection>Smoky Mountains Hiking Club Records</collection>
        <collection_identifier>MS.0423</collection_identifier>
        <shelf_locator>Box 1</shelf_locator>
        <extent>3.5 x 5.75 inches</extent>
        <form>photographs | http://vocab.getty.edu/aat/300046300</form>
        <language>eng</language>
        <subject_geographic>Great Smoky Mountains | URI: http://id.loc.gov/authorities/subjects/sh85057008 | Coordinates: 35.58343, -83.50822</subject_geographic>
        <subject_geographic>Abrams Falls (Tenn.) | Coordinates: 35.60842, -83.87962</subject_geographic>
        <subject_name>Smoky Mountains Hiking Club</subject_name>
        <project_title>Smoky Mountains Hiking Club Handbooks</project_title>
        <repository>University of Tennessee, Knoxville. Special Collections</repository>
        <rights>The copyright interests in this item remain with the creator. For more information, contact Special Collections at special@utk.edu.</rights>
        <public_note>Title is from information on back of photograph.</public_note>
        <public_note>Collection donated by Laura E. and Ella Luttrell</public_note>
        <digital_origin>reformatted digital</digital_origin>
        <item_type>still image</item_type>
    </row>
    <row>
        <identifier>HikingClub_photos_0010</identifier>
        <title>Abrams Falls Jan 7-8-1928 (image number 34)</title>
        <date_text>1/8/1928</date_text>
        <date_single_start>1928-01-08</date_single_start>
        <collection>Smoky Mountains Hiking Club Records</collection>
        <collection_identifier>MS.0423</collection_identifier>
        <shelf_locator>Box 1</shelf_locator>
        <extent>3.5 x 5.75 inches</extent>
        <form>photographs | http://vocab.getty.edu/aat/300046300</form>
        <language>eng</language>
        <subject_geographic>Great Smoky Mountains | URI: http://id.loc.gov/authorities/subjects/sh85057008 | Coordinates: 35.58343, -83.50822</subject_geographic>
        <subject_geographic>Abrams Falls (Tenn.) | Coordinates: 35.60842, -83.87962</subject_geographic>
        <subject_name>Smoky Mountains Hiking Club</subject_name>
        <project_title>Smoky Mountains Hiking Club Handbooks</project_title>
        <repository>University of Tennessee, Knoxville. Special Collections</repository>
        <rights>The copyright interests in this item remain with the creator. For more information, contact Special Collections at special@utk.edu.</rights>
        <public_note>Title is from information on back of photograph.</public_note>
        <public_note>Collection donated by Laura E. and Ella Luttrell</public_note>
        <digital_origin>reformatted digital</digital_origin>
        <item_type>still image</item_type>
    </row>
    <row>
        <identifier>HikingClub_photos_0011</identifier>
        <title>Abrams Falls Jan 7-8-1928 (image number 35)</title>
        <date_text>1/8/1928</date_text>
        <date_single_start>1928-01-08</date_single_start>
        <collection>Smoky Mountains Hiking Club Records</collection>
        <collection_identifier>MS.0423</collection_identifier>
        <shelf_locator>Box 1</shelf_locator>
        <extent>3.5 x 5.75 inches</extent>
        <form>photographs | http://vocab.getty.edu/aat/300046300</form>
        <language>eng</language>
        <subject_geographic>Great Smoky Mountains | URI: http://id.loc.gov/authorities/subjects/sh85057008 | Coordinates: 35.58343, -83.50822</subject_geographic>
        <subject_geographic>Abrams Falls (Tenn.) | Coordinates: 35.60842, -83.87962</subject_geographic>
        <subject_name>Smoky Mountains Hiking Club</subject_name>
        <project_title>Smoky Mountains Hiking Club Handbooks</project_title>
        <repository>University of Tennessee, Knoxville. Special Collections</repository>
        <rights>The copyright interests in this item remain with the creator. For more information, contact Special Collections at special@utk.edu.</rights>
        <public_note>Title is from information on back of photograph.</public_note>
        <public_note>Collection donated by Laura E. and Ella Luttrell</public_note>
        <digital_origin>reformatted digital</digital_origin>
        <item_type>still image</item_type>
    </row>
    <row>
        <identifier>HikingClub_photos_0012</identifier>
        <title>Near Abrams Falls Jan 7-8-1928 (image number 62)</title>
        <date_text>1/8/1928</date_text>
        <date_single_start>1928-01-08</date_single_start>
        <collection>Smoky Mountains Hiking Club Records</collection>
        <collection_identifier>MS.0423</collection_identifier>
        <shelf_locator>Box 1</shelf_locator>
        <extent>3.5 x 5.75 inches</extent>
        <form>photographs | http://vocab.getty.edu/aat/300046300</form>
        <language>eng</language>
        <subject_geographic>Great Smoky Mountains | URI: http://id.loc.gov/authorities/subjects/sh85057008 | Coordinates: 35.58343, -83.50822</subject_geographic>
        <subject_geographic>Abrams Falls (Tenn.) | Coordinates: 35.60842, -83.87962</subject_geographic>
        <subject_name>Smoky Mountains Hiking Club</subject_name>
        <project_title>Smoky Mountains Hiking Club Handbooks</project_title>
        <repository>University of Tennessee, Knoxville. Special Collections</repository>
        <rights>The copyright interests in this item remain with the creator. For more information, contact Special Collections at special@utk.edu.</rights>
        <public_note>Title is from information on back of photograph.</public_note>
        <public_note>Collection donated by Laura E. and Ella Luttrell</public_note>
        <digital_origin>reformatted digital</digital_origin>
        <item_type>still image</item_type>
    </row>
    <row>
        <identifier>HikingClub_photos_0013</identifier>
        <title>Abrams Falls Jan 7-8-1928 (image number 63)</title>
        <date_text>1/8/1928</date_text>
        <date_single_start>1928-01-08</date_single_start>
        <collection>Smoky Mountains Hiking Club Records</collection>
        <collection_identifier>MS.0423</collection_identifier>
        <shelf_locator>Box 1</shelf_locator>
        <extent>3.5 x 5.75 inches</extent>
        <form>photographs | http://vocab.getty.edu/aat/300046300</form>
        <language>eng</language>
        <subject_geographic>Great Smoky Mountains | URI: http://id.loc.gov/authorities/subjects/sh85057008 | Coordinates: 35.58343, -83.50822</subject_geographic>
        <subject_geographic>Abrams Falls (Tenn.) | Coordinates: 35.60842, -83.87962</subject_geographic>
        <subject_name>Smoky Mountains Hiking Club</subject_name>
        <project_title>Smoky Mountains Hiking Club Handbooks</project_title>
        <repository>University of Tennessee, Knoxville. Special Collections</repository>
        <rights>The copyright interests in this item remain with the creator. For more information, contact Special Collections at special@utk.edu.</rights>
        <public_note>Title is from information on back of photograph.</public_note>
        <public_note>Collection donated by Laura E. and Ella Luttrell</public_note>
        <digital_origin>reformatted digital</digital_origin>
        <item_type>still image</item_type>
    </row>
    <row>
        <identifier>HikingClub_photos_0014</identifier>
        <title>Abrams Falls Jan 7-8-1928 (image number 64)</title>
        <date_text>1/8/1928</date_text>
        <date_single_start>1928-01-08</date_single_start>
        <collection>Smoky Mountains Hiking Club Records</collection>
        <collection_identifier>MS.0423</collection_identifier>
        <shelf_locator>Box 1</shelf_locator>
        <extent>3.5 x 5.75 inches</extent>
        <form>photographs | http://vocab.getty.edu/aat/300046300</form>
        <language>eng</language>
        <subject_geographic>Great Smoky Mountains | URI: http://id.loc.gov/authorities/subjects/sh85057008 | Coordinates: 35.58343, -83.50822</subject_geographic>
        <subject_geographic>Abrams Falls (Tenn.) | Coordinates: 35.60842, -83.87962</subject_geographic>
        <subject_name>Smoky Mountains Hiking Club</subject_name>
        <project_title>Smoky Mountains Hiking Club Handbooks</project_title>
        <repository>University of Tennessee, Knoxville. Special Collections</repository>
        <rights>The copyright interests in this item remain with the creator. For more information, contact Special Collections at special@utk.edu.</rights>
        <public_note>Title is from information on back of photograph.</public_note>
        <public_note>Collection donated by Laura E. and Ella Luttrell</public_note>
        <digital_origin>reformatted digital</digital_origin>
        <item_type>still image</item_type>
    </row>
    <row>
        <identifier>HikingClub_photos_0015</identifier>
        <title>Sunshine from Mt. Luke Jan 22-1928 (image number 23)</title>
        <date_text>1/22/1928</date_text>
        <date_single_start>1928-01-22</date_single_start>
        <collection>Smoky Mountains Hiking Club Records</collection>
        <collection_identifier>MS.0423</collection_identifier>
        <shelf_locator>Box 1</shelf_locator>
        <extent>3.5 x 5.75 inches</extent>
        <form>photographs | http://vocab.getty.edu/aat/300046300</form>
        <language>eng</language>
        <subject_geographic>Great Smoky Mountains | URI: http://id.loc.gov/authorities/subjects/sh85057008 | Coordinates: 35.58343, -83.50822</subject_geographic>
        <subject_geographic>Sunshine (Tenn.) | Coordinates: 35.68342, -83.79351</subject_geographic>
        <subject_geographic>Luke, Mount (Tenn.)</subject_geographic>
        <subject_name>Smoky Mountains Hiking Club</subject_name>
        <project_title>Smoky Mountains Hiking Club Handbooks</project_title>
        <repository>University of Tennessee, Knoxville. Special Collections</repository>
        <rights>The copyright interests in this item remain with the creator. For more information, contact Special Collections at special@utk.edu.</rights>
        <public_note>Title is from information on back of photograph.</public_note>
        <public_note>Collection donated by Laura E. and Ella Luttrell</public_note>
        <digital_origin>reformatted digital</digital_origin>
        <item_type>still image</item_type>
    </row>
    <row>
        <identifier>HikingClub_photos_0016</identifier>
        <title>Looking toward Townsend from Mt. Luke Jan 22-1928 (image number 24)</title>
        <date_text>1/22/1928</date_text>
        <date_single_start>1928-01-22</date_single_start>
        <collection>Smoky Mountains Hiking Club Records</collection>
        <collection_identifier>MS.0423</collection_identifier>
        <shelf_locator>Box 1</shelf_locator>
        <extent>3.5 x 5.75 inches</extent>
        <form>photographs | http://vocab.getty.edu/aat/300046300</form>
        <language>eng</language>
        <subject_geographic>Great Smoky Mountains | URI: http://id.loc.gov/authorities/subjects/sh85057008 | Coordinates: 35.58343, -83.50822</subject_geographic>
        <subject_geographic>Townsend (Tenn.) | URI: http://id.loc.gov/authorities/names/n89110546 | Coordinates: 35.67537, -83.75573</subject_geographic>
        <subject_geographic>Luke, Mount (Tenn.)</subject_geographic>
        <subject_name>Smoky Mountains Hiking Club</subject_name>
        <project_title>Smoky Mountains Hiking Club Handbooks</project_title>
        <repository>University of Tennessee, Knoxville. Special Collections</repository>
        <rights>The copyright interests in this item remain with the creator. For more information, contact Special Collections at special@utk.edu.</rights>
        <public_note>Title is from information on back of photograph.</public_note>
        <public_note>Collection donated by Laura E. and Ella Luttrell</public_note>
        <digital_origin>reformatted digital</digital_origin>
        <item_type>still image</item_type>
    </row>
    <row>
        <identifier>HikingClub_photos_0017</identifier>
        <title>Rich Mt. from Mt. Luke at Sunshine Jan 22-1928(image number 25)</title>
        <date_text>1/22/1928</date_text>
        <date_single_start>1928-01-22</date_single_start>
        <collection>Smoky Mountains Hiking Club Records</collection>
        <collection_identifier>MS.0423</collection_identifier>
        <shelf_locator>Box 1</shelf_locator>
        <extent>3.5 x 5.75 inches</extent>
        <form>photographs | http://vocab.getty.edu/aat/300046300</form>
        <language>eng</language>
        <subject_geographic>Great Smoky Mountains | URI: http://id.loc.gov/authorities/subjects/sh85057008 | Coordinates: 35.58343, -83.50822</subject_geographic>
        <subject_geographic>Rich Mountain (Tenn.)</subject_geographic>
        <subject_geographic>Luke, Mount (Tenn.)</subject_geographic>
        <subject_geographic>Sunshine (Tenn.) | Coordinates: 35.68342, -83.79351</subject_geographic>
        <subject_name>Smoky Mountains Hiking Club</subject_name>
        <project_title>Smoky Mountains Hiking Club Handbooks</project_title>
        <repository>University of Tennessee, Knoxville. Special Collections</repository>
        <rights>The copyright interests in this item remain with the creator. For more information, contact Special Collections at special@utk.edu.</rights>
        <public_note>Title is from information on back of photograph.</public_note>
        <public_note>Collection donated by Laura E. and Ella Luttrell</public_note>
        <digital_origin>reformatted digital</digital_origin>
        <item_type>still image</item_type>
    </row>
    <row>
        <identifier>HikingClub_photos_0018</identifier>
        <title>Club on top of Mt. Luke Jan. 22-1928 (image number 26)</title>
        <date_text>1/22/1928</date_text>
        <date_single_start>1928-01-22</date_single_start>
        <collection>Smoky Mountains Hiking Club Records</collection>
        <collection_identifier>MS.0423</collection_identifier>
        <shelf_locator>Box 1</shelf_locator>
        <extent>3.5 x 5.75 inches</extent>
        <form>photographs | http://vocab.getty.edu/aat/300046300</form>
        <language>eng</language>
        <subject_geographic>Great Smoky Mountains | URI: http://id.loc.gov/authorities/subjects/sh85057008 | Coordinates: 35.58343, -83.50822</subject_geographic>
        <subject_geographic>Luke, Mount (Tenn.)</subject_geographic>
        <subject_name>Smoky Mountains Hiking Club</subject_name>
        <project_title>Smoky Mountains Hiking Club Handbooks</project_title>
        <repository>University of Tennessee, Knoxville. Special Collections</repository>
        <rights>The copyright interests in this item remain with the creator. For more information, contact Special Collections at special@utk.edu.</rights>
        <public_note>Title is from information on back of photograph.</public_note>
        <public_note>Collection donated by Laura E. and Ella Luttrell</public_note>
        <digital_origin>reformatted digital</digital_origin>
        <item_type>still image</item_type>
    </row>
    <row>
        <identifier>HikingClub_photos_0019</identifier>
        <title>At Sunshine in Mt. Luke Trip. Flash Light picture Jan 22-1928 (image number 27)</title>
        <date_text>1/22/1928</date_text>
        <date_single_start>1928-01-22</date_single_start>
        <collection>Smoky Mountains Hiking Club Records</collection>
        <collection_identifier>MS.0423</collection_identifier>
        <shelf_locator>Box 1</shelf_locator>
        <extent>3.5 x 5.75 inches</extent>
        <form>photographs | http://vocab.getty.edu/aat/300046300</form>
        <language>eng</language>
        <subject_geographic>Great Smoky Mountains | URI: http://id.loc.gov/authorities/subjects/sh85057008 | Coordinates: 35.58343, -83.50822</subject_geographic>
        <subject_geographic>Sunshine (Tenn.) | Coordinates: 35.68342, -83.79351</subject_geographic>
        <subject_geographic>Luke, Mount (Tenn.)</subject_geographic>
        <subject_name>Smoky Mountains Hiking Club</subject_name>
        <project_title>Smoky Mountains Hiking Club Handbooks</project_title>
        <repository>University of Tennessee, Knoxville. Special Collections</repository>
        <rights>The copyright interests in this item remain with the creator. For more information, contact Special Collections at special@utk.edu.</rights>
        <public_note>Title is from information on back of photograph.</public_note>
        <public_note>Collection donated by Laura E. and Ella Luttrell</public_note>
        <digital_origin>reformatted digital</digital_origin>
        <item_type>still image</item_type>
    </row>
    <row>
        <identifier>HikingClub_photos_0020</identifier>
        <title>On way to Mt. Harrison Feb 4-5-1928 (image number 36)</title>
        <date_text>2/4-5/1928</date_text>
        <date_single_start>1928-02-04</date_single_start>
        <date_range_end>1928-02-05</date_range_end>
        <collection>Smoky Mountains Hiking Club Records</collection>
        <collection_identifier>MS.0423</collection_identifier>
        <shelf_locator>Box 1</shelf_locator>
        <extent>3.5 x 5.75 inches</extent>
        <form>photographs | http://vocab.getty.edu/aat/300046300</form>
        <language>eng</language>
        <subject_geographic>Great Smoky Mountains | URI: http://id.loc.gov/authorities/subjects/sh85057008 | Coordinates: 35.58343, -83.50822</subject_geographic>
        <subject_geographic>Harrison, Mount (Tenn.) | Coordinates: 35.69676, -83.57267</subject_geographic>
        <subject_name>Smoky Mountains Hiking Club</subject_name>
        <project_title>Smoky Mountains Hiking Club Handbooks</project_title>
        <repository>University of Tennessee, Knoxville. Special Collections</repository>
        <rights>The copyright interests in this item remain with the creator. For more information, contact Special Collections at special@utk.edu.</rights>
        <public_note>Title is from information on back of photograph.</public_note>
        <public_note>Collection donated by Laura E. and Ella Luttrell</public_note>
        <digital_origin>reformatted digital</digital_origin>
        <item_type>still image</item_type>
    </row>
    <row>
        <identifier>HikingClub_photos_0022</identifier>
        <title>Club at Uncle Tom's Cabin Feb 4-5-1928 (image number 38)</title>
        <date_text>2/4-5/1928</date_text>
        <date_single_start>1928-02-04</date_single_start>
        <date_range_end>1928-02-05</date_range_end>
        <collection>Smoky Mountains Hiking Club Records</collection>
        <collection_identifier>MS.0423</collection_identifier>
        <shelf_locator>Box 1</shelf_locator>
        <extent>3.5 x 5.75 inches</extent>
        <form>photographs | http://vocab.getty.edu/aat/300046300</form>
        <language>eng</language>
        <subject_geographic>Great Smoky Mountains | URI: http://id.loc.gov/authorities/subjects/sh85057008 | Coordinates: 35.58343, -83.50822</subject_geographic>
        <subject_geographic>Tom Campbell's cabin</subject_geographic>
        <subject_name>Smoky Mountains Hiking Club</subject_name>
        <project_title>Smoky Mountains Hiking Club Handbooks</project_title>
        <repository>University of Tennessee, Knoxville. Special Collections</repository>
        <rights>The copyright interests in this item remain with the creator. For more information, contact Special Collections at special@utk.edu.</rights>
        <public_note>Title is from information on back of photograph.</public_note>
        <public_note>Collection donated by Laura E. and Ella Luttrell</public_note>
        <digital_origin>reformatted digital</digital_origin>
        <item_type>still image</item_type>
    </row>
    <row>
        <identifier>HikingClub_photos_0023</identifier>
        <title>On way to Rocky Spur from Le Conte March 3-4-1928 (image number 81)</title>
        <date_text>3/3-4/1928</date_text>
        <date_single_start>1928-03-03</date_single_start>
        <date_range_end>1928-03-04</date_range_end>
        <collection>Smoky Mountains Hiking Club Records</collection>
        <collection_identifier>MS.0423</collection_identifier>
        <shelf_locator>Box 1</shelf_locator>
        <extent>3.5 x 5.75 inches</extent>
        <form>photographs | http://vocab.getty.edu/aat/300046300</form>
        <language>eng</language>
        <subject_geographic>Great Smoky Mountains | URI: http://id.loc.gov/authorities/subjects/sh85057008 | Coordinates: 35.58343, -83.50822</subject_geographic>
        <subject_geographic>Rocky Spur (Tenn.) | Coordinates: 35.66259, -83.45099</subject_geographic>
        <subject_geographic>LeConte, Mount (Tenn.) | URI: http://id.loc.gov/authorities/subjects/sh86006260 | Coordinates: 35.65426, -83.43683</subject_geographic>
        <subject_name>Smoky Mountains Hiking Club</subject_name>
        <project_title>Smoky Mountains Hiking Club Handbooks</project_title>
        <repository>University of Tennessee, Knoxville. Special Collections</repository>
        <rights>The copyright interests in this item remain with the creator. For more information, contact Special Collections at special@utk.edu.</rights>
        <public_note>Title is from information on back of photograph.</public_note>
        <public_note>Collection donated by Laura E. and Ella Luttrell</public_note>
        <digital_origin>reformatted digital</digital_origin>
        <item_type>still image</item_type>
    </row>
    <row>
        <identifier>HikingClub_photos_0024</identifier>
        <title>On way to Russells Peach Orchard March 18-1928 (image number 80)</title>
        <date_text>3/18/1928</date_text>
        <date_single_start>1928-03-18</date_single_start>
        <collection>Smoky Mountains Hiking Club Records</collection>
        <collection_identifier>MS.0423</collection_identifier>
        <shelf_locator>Box 1</shelf_locator>
        <extent>3.5 x 5.75 inches</extent>
        <form>photographs | http://vocab.getty.edu/aat/300046300</form>
        <language>eng</language>
        <subject_geographic>Great Smoky Mountains | URI: http://id.loc.gov/authorities/subjects/sh85057008 | Coordinates: 35.58343, -83.50822</subject_geographic>
        <subject_name>Smoky Mountains Hiking Club</subject_name>
        <project_title>Smoky Mountains Hiking Club Handbooks</project_title>
        <repository>University of Tennessee, Knoxville. Special Collections</repository>
        <rights>The copyright interests in this item remain with the creator. For more information, contact Special Collections at special@utk.edu.</rights>
        <public_note>Title is from information on back of photograph.</public_note>
        <public_note>Collection donated by Laura E. and Ella Luttrell</public_note>
        <digital_origin>reformatted digital</digital_origin>
        <item_type>still image</item_type>
    </row>
    <row>
        <identifier>HikingClub_photos_0025</identifier>
        <title>At Russells Peach Orchard March 18-1928 (image number 79)</title>
        <abstract>Albert "Dutch" Roth center front (in hat)</abstract>
        <date_text>3/18/1928</date_text>
        <date_single_start>1928-03-18</date_single_start>
        <collection>Smoky Mountains Hiking Club Records</collection>
        <collection_identifier>MS.0423</collection_identifier>
        <shelf_locator>Box 1</shelf_locator>
        <extent>3.5 x 5.75 inches</extent>
        <form>photographs | http://vocab.getty.edu/aat/300046300</form>
        <language>eng</language>
        <subject_geographic>Great Smoky Mountains | URI: http://id.loc.gov/authorities/subjects/sh85057008 | Coordinates: 35.58343, -83.50822</subject_geographic>
        <subject_name>Smoky Mountains Hiking Club</subject_name>
        <project_title>Smoky Mountains Hiking Club Handbooks</project_title>
        <repository>University of Tennessee, Knoxville. Special Collections</repository>
        <rights>The copyright interests in this item remain with the creator. For more information, contact Special Collections at special@utk.edu.</rights>
        <public_note>Title is from information on back of photograph.</public_note>
        <public_note>Collection donated by Laura E. and Ella Luttrell</public_note>
        <digital_origin>reformatted digital</digital_origin>
        <item_type>still image</item_type>
    </row>
    <row>
        <identifier>HikingClub_photos_0026</identifier>
        <title>Neubert Spring instead of Cherokee Bluff on account of Rain May 20-1928 (image number 97)</title>
        <date_text>5/20/1928</date_text>
        <date_single_start>1928-05-20</date_single_start>
        <collection>Smoky Mountains Hiking Club Records</collection>
        <collection_identifier>MS.0423</collection_identifier>
        <shelf_locator>Box 1</shelf_locator>
        <extent>3.5 x 5.75 inches</extent>
        <form>photographs | http://vocab.getty.edu/aat/300046300</form>
        <language>eng</language>
        <subject_geographic>Great Smoky Mountains | URI: http://id.loc.gov/authorities/subjects/sh85057008 | Coordinates: 35.58343, -83.50822</subject_geographic>
        <subject_geographic>Neubert Springs (Tenn.) | Coordinates: 35.87925, -83.87435</subject_geographic>
        <subject_name>Smoky Mountains Hiking Club</subject_name>
        <project_title>Smoky Mountains Hiking Club Handbooks</project_title>
        <repository>University of Tennessee, Knoxville. Special Collections</repository>
        <rights>The copyright interests in this item remain with the creator. For more information, contact Special Collections at special@utk.edu.</rights>
        <public_note>Title is from information on back of photograph.</public_note>
        <public_note>Collection donated by Laura E. and Ella Luttrell</public_note>
        <digital_origin>reformatted digital</digital_origin>
        <item_type>still image</item_type>
    </row>
    <row>
        <identifier>HikingClub_photos_0028</identifier>
        <title>Neubert Spring instead of Cherokee Bluffs May 20-1928 (image number 101)</title>
        <date_text>5/20/1928</date_text>
        <date_single_start>1928-05-20</date_single_start>
        <collection>Smoky Mountains Hiking Club Records</collection>
        <collection_identifier>MS.0423</collection_identifier>
        <shelf_locator>Box 1</shelf_locator>
        <extent>3.5 x 5.75 inches</extent>
        <form>photographs | http://vocab.getty.edu/aat/300046300</form>
        <language>eng</language>
        <subject_geographic>Great Smoky Mountains | URI: http://id.loc.gov/authorities/subjects/sh85057008 | Coordinates: 35.58343, -83.50822</subject_geographic>
        <subject_geographic>Neubert Springs (Tenn.) | Coordinates: 35.87925, -83.87435</subject_geographic>
        <subject_name>Smoky Mountains Hiking Club</subject_name>
        <project_title>Smoky Mountains Hiking Club Handbooks</project_title>
        <repository>University of Tennessee, Knoxville. Special Collections</repository>
        <rights>The copyright interests in this item remain with the creator. For more information, contact Special Collections at special@utk.edu.</rights>
        <public_note>Title is from information on back of photograph.</public_note>
        <public_note>Collection donated by Laura E. and Ella Luttrell</public_note>
        <digital_origin>reformatted digital</digital_origin>
        <item_type>still image</item_type>
    </row>
    <row>
        <identifier>HikingClub_photos_0029</identifier>
        <title>Cave Coves &amp; Thunderhead in Distance on Thunderhead hike June 2-3-1928 (image number 103)</title>
        <date_text>6/2-3/1928</date_text>
        <date_single_start>1928-06-02</date_single_start>
        <date_range_end>1928-06-03</date_range_end>
        <collection>Smoky Mountains Hiking Club Records</collection>
        <collection_identifier>MS.0423</collection_identifier>
        <shelf_locator>Box 1</shelf_locator>
        <extent>3.5 x 5.75 inches</extent>
        <form>photographs | http://vocab.getty.edu/aat/300046300</form>
        <language>eng</language>
        <subject_geographic>Great Smoky Mountains | URI: http://id.loc.gov/authorities/subjects/sh85057008 | Coordinates: 35.58343, -83.50822</subject_geographic>
        <subject_geographic>Cades Cove (Tenn.) | URI: http://id.loc.gov/authorities/subjects/sh85018626 | Coordinates: 35.59426, -83.84184</subject_geographic>
        <subject_geographic>Thunderhead Mountain (Tenn.) | Coordinates: 35.5687, -83.70628</subject_geographic>
        <subject_name>Smoky Mountains Hiking Club</subject_name>
        <project_title>Smoky Mountains Hiking Club Handbooks</project_title>
        <repository>University of Tennessee, Knoxville. Special Collections</repository>
        <rights>The copyright interests in this item remain with the creator. For more information, contact Special Collections at special@utk.edu.</rights>
        <public_note>Title is from information on back of photograph.</public_note>
        <public_note>Collection donated by Laura E. and Ella Luttrell</public_note>
        <digital_origin>reformatted digital</digital_origin>
        <item_type>still image</item_type>
    </row>
    <row>
        <identifier>HikingClub_photos_0030</identifier>
        <title>On way to Thunderhead June 2-3-1928 (image number 104)</title>
        <date_text>6/2-3/1928</date_text>
        <date_single_start>1928-06-02</date_single_start>
        <date_range_end>1928-06-03</date_range_end>
        <collection>Smoky Mountains Hiking Club Records</collection>
        <collection_identifier>MS.0423</collection_identifier>
        <shelf_locator>Box 1</shelf_locator>
        <extent>3.5 x 5.75 inches</extent>
        <form>photographs | http://vocab.getty.edu/aat/300046300</form>
        <language>eng</language>
        <subject_geographic>Great Smoky Mountains | URI: http://id.loc.gov/authorities/subjects/sh85057008 | Coordinates: 35.58343, -83.50822</subject_geographic>
        <subject_geographic>Thunderhead Mountain (Tenn.) | Coordinates: 35.5687, -83.70628</subject_geographic>
        <subject_name>Smoky Mountains Hiking Club</subject_name>
        <project_title>Smoky Mountains Hiking Club Handbooks</project_title>
        <repository>University of Tennessee, Knoxville. Special Collections</repository>
        <rights>The copyright interests in this item remain with the creator. For more information, contact Special Collections at special@utk.edu.</rights>
        <public_note>Title is from information on back of photograph.</public_note>
        <public_note>Collection donated by Laura E. and Ella Luttrell</public_note>
        <digital_origin>reformatted digital</digital_origin>
        <item_type>still image</item_type>
    </row>
    <row>
        <identifier>HikingClub_photos_0031</identifier>
        <title>Spend night on way to Thunderhead June 2-3-1928 (image number 105)</title>
        <abstract>Albert "Dutch" Roth first on left in front row</abstract>
        <date_text>6/2-3/1928</date_text>
        <date_single_start>1928-06-02</date_single_start>
        <date_range_end>1928-06-03</date_range_end>
        <collection>Smoky Mountains Hiking Club Records</collection>
        <collection_identifier>MS.0423</collection_identifier>
        <shelf_locator>Box 1</shelf_locator>
        <extent>3.5 x 5.75 inches</extent>
        <form>photographs | http://vocab.getty.edu/aat/300046300</form>
        <language>eng</language>
        <subject_geographic>Great Smoky Mountains | URI: http://id.loc.gov/authorities/subjects/sh85057008 | Coordinates: 35.58343, -83.50822</subject_geographic>
        <subject_geographic>Thunderhead Mountain (Tenn.) | Coordinates: 35.5687, -83.70628</subject_geographic>
        <subject_name>Smoky Mountains Hiking Club</subject_name>
        <project_title>Smoky Mountains Hiking Club Handbooks</project_title>
        <repository>University of Tennessee, Knoxville. Special Collections</repository>
        <rights>The copyright interests in this item remain with the creator. For more information, contact Special Collections at special@utk.edu.</rights>
        <public_note>Title is from information on back of photograph.</public_note>
        <public_note>Collection donated by Laura E. and Ella Luttrell</public_note>
        <digital_origin>reformatted digital</digital_origin>
        <item_type>still image</item_type>
    </row>
    <row>
        <identifier>HikingClub_photos_0032</identifier>
        <title>Cave Cove on way to Thunderhead June 2-3-1928 (image number 106)</title>
        <date_text>6/2-3/1928</date_text>
        <date_single_start>1928-06-02</date_single_start>
        <date_range_end>1928-06-03</date_range_end>
        <collection>Smoky Mountains Hiking Club Records</collection>
        <collection_identifier>MS.0423</collection_identifier>
        <shelf_locator>Box 1</shelf_locator>
        <extent>3.5 x 5.75 inches</extent>
        <form>photographs | http://vocab.getty.edu/aat/300046300</form>
        <language>eng</language>
        <subject_geographic>Great Smoky Mountains | URI: http://id.loc.gov/authorities/subjects/sh85057008 | Coordinates: 35.58343, -83.50822</subject_geographic>
        <subject_geographic>Cades Cove (Tenn.) | URI: http://id.loc.gov/authorities/subjects/sh85018626 | Coordinates: 35.59426, -83.84184</subject_geographic>
        <subject_geographic>Thunderhead Mountain (Tenn.) | Coordinates: 35.5687, -83.70628</subject_geographic>
        <subject_name>Smoky Mountains Hiking Club</subject_name>
        <project_title>Smoky Mountains Hiking Club Handbooks</project_title>
        <repository>University of Tennessee, Knoxville. Special Collections</repository>
        <rights>The copyright interests in this item remain with the creator. For more information, contact Special Collections at special@utk.edu.</rights>
        <public_note>Title is from information on back of photograph.</public_note>
        <public_note>Collection donated by Laura E. and Ella Luttrell</public_note>
        <digital_origin>reformatted digital</digital_origin>
        <item_type>still image</item_type>
    </row>
    <row>
        <identifier>HikingClub_photos_0033</identifier>
        <title>Taken on way to Thunderhead June 2-3-1928 (image number 107)</title>
        <date_text>6/2-3/1928</date_text>
        <date_single_start>1928-06-02</date_single_start>
        <date_range_end>1928-06-03</date_range_end>
        <collection>Smoky Mountains Hiking Club Records</collection>
        <collection_identifier>MS.0423</collection_identifier>
        <shelf_locator>Box 1</shelf_locator>
        <extent>3.5 x 5.75 inches</extent>
        <form>photographs | http://vocab.getty.edu/aat/300046300</form>
        <language>eng</language>
        <subject_geographic>Great Smoky Mountains | URI: http://id.loc.gov/authorities/subjects/sh85057008 | Coordinates: 35.58343, -83.50822</subject_geographic>
        <subject_geographic>Thunderhead Mountain (Tenn.) | Coordinates: 35.5687, -83.70628</subject_geographic>
        <subject_name>Smoky Mountains Hiking Club</subject_name>
        <project_title>Smoky Mountains Hiking Club Handbooks</project_title>
        <repository>University of Tennessee, Knoxville. Special Collections</repository>
        <rights>The copyright interests in this item remain with the creator. For more information, contact Special Collections at special@utk.edu.</rights>
        <public_note>Title is from information on back of photograph.</public_note>
        <public_note>Collection donated by Laura E. and Ella Luttrell</public_note>
        <digital_origin>reformatted digital</digital_origin>
        <item_type>still image</item_type>
    </row>
    <row>
        <identifier>HikingClub_photos_0034</identifier>
        <title>On way to Thunderhead June 2-3-1928 (image number 108)</title>
        <date_text>6/2-3/1928</date_text>
        <date_single_start>1928-06-02</date_single_start>
        <date_range_end>1928-06-03</date_range_end>
        <collection>Smoky Mountains Hiking Club Records</collection>
        <collection_identifier>MS.0423</collection_identifier>
        <shelf_locator>Box 1</shelf_locator>
        <extent>3.5 x 5.75 inches</extent>
        <form>photographs | http://vocab.getty.edu/aat/300046300</form>
        <language>eng</language>
        <subject_geographic>Great Smoky Mountains | URI: http://id.loc.gov/authorities/subjects/sh85057008 | Coordinates: 35.58343, -83.50822</subject_geographic>
        <subject_geographic>Thunderhead Mountain (Tenn.) | Coordinates: 35.5687, -83.70628</subject_geographic>
        <subject_name>Smoky Mountains Hiking Club</subject_name>
        <project_title>Smoky Mountains Hiking Club Handbooks</project_title>
        <repository>University of Tennessee, Knoxville. Special Collections</repository>
        <rights>The copyright interests in this item remain with the creator. For more information, contact Special Collections at special@utk.edu.</rights>
        <public_note>Title is from information on back of photograph.</public_note>
        <public_note>Collection donated by Laura E. and Ella Luttrell</public_note>
        <digital_origin>reformatted digital</digital_origin>
        <item_type>still image</item_type>
    </row>
    <row>
        <identifier>HikingClub_photos_0035</identifier>
        <title>Along the trail from Porters Flats to Dry Sluice Gap after a cloudburst July 29-1928 (image number 143)</title>
        <date_text>7/29/1928</date_text>
        <date_single_start>1928-07-29</date_single_start>
        <collection>Smoky Mountains Hiking Club Records</collection>
        <collection_identifier>MS.0423</collection_identifier>
        <shelf_locator>Box 1</shelf_locator>
        <extent>3.5 x 5.75 inches</extent>
        <form>photographs | http://vocab.getty.edu/aat/300046300</form>
        <language>eng</language>
        <subject_geographic>Great Smoky Mountains | URI: http://id.loc.gov/authorities/subjects/sh85057008 | Coordinates: 35.58343, -83.50822</subject_geographic>
        <subject_geographic>Porters Flat (Tenn.) | Coordinates: 35.68371, -83.39933</subject_geographic>
        <subject_geographic>Dry Sluice Gap (Tenn.) | Coordinates: 35.63815, -83.36793</subject_geographic>
        <subject_name>Smoky Mountains Hiking Club</subject_name>
        <project_title>Smoky Mountains Hiking Club Handbooks</project_title>
        <repository>University of Tennessee, Knoxville. Special Collections</repository>
        <rights>The copyright interests in this item remain with the creator. For more information, contact Special Collections at special@utk.edu.</rights>
        <public_note>Title is from information on back of photograph.</public_note>
        <public_note>Collection donated by Laura E. and Ella Luttrell</public_note>
        <digital_origin>reformatted digital</digital_origin>
        <item_type>still image</item_type>
    </row>
    <row>
        <identifier>HikingClub_photos_0036</identifier>
        <title>Along the trail from Porters Flats to Mt. Alexander (or Mt. Collins) after cloudburst July 29-1928 (image number 140)</title>
        <date_text>7/29/1928</date_text>
        <date_single_start>1928-07-29</date_single_start>
        <collection>Smoky Mountains Hiking Club Records</collection>
        <collection_identifier>MS.0423</collection_identifier>
        <shelf_locator>Box 1</shelf_locator>
        <extent>3.5 x 5.75 inches</extent>
        <form>photographs | http://vocab.getty.edu/aat/300046300</form>
        <language>eng</language>
        <subject_geographic>Great Smoky Mountains | URI: http://id.loc.gov/authorities/subjects/sh85057008 | Coordinates: 35.58343, -83.50822</subject_geographic>
        <subject_geographic>Porters Flat (Tenn.) | Coordinates: 35.68371, -83.39933</subject_geographic>
        <subject_geographic>Kephart, Mount (N.C. and Tenn.) | Coordinates: 35.63065, -83.3896</subject_geographic>
        <subject_name>Smoky Mountains Hiking Club</subject_name>
        <project_title>Smoky Mountains Hiking Club Handbooks</project_title>
        <repository>University of Tennessee, Knoxville. Special Collections</repository>
        <rights>The copyright interests in this item remain with the creator. For more information, contact Special Collections at special@utk.edu.</rights>
        <public_note>Title is from information on back of photograph.</public_note>
        <public_note>Collection donated by Laura E. and Ella Luttrell</public_note>
        <digital_origin>reformatted digital</digital_origin>
        <item_type>still image</item_type>
    </row>
    <row>
        <identifier>HikingClub_photos_0037</identifier>
        <title>Sugarland Mt. from Bear Pen Hollow Trail May 18-19-1929 (image number 257)</title>
        <date_text>5/18-19/1929</date_text>
        <date_single_start>1929-05-18</date_single_start>
        <date_range_end>1929-05-19</date_range_end>
        <collection>Smoky Mountains Hiking Club Records</collection>
        <collection_identifier>MS.0423</collection_identifier>
        <shelf_locator>Box 1</shelf_locator>
        <extent>3.5 x 5.75 inches</extent>
        <form>photographs | http://vocab.getty.edu/aat/300046300</form>
        <language>eng</language>
        <subject_geographic>Great Smoky Mountains | URI: http://id.loc.gov/authorities/subjects/sh85057008 | Coordinates: 35.58343, -83.50822</subject_geographic>
        <subject_geographic>Sugarland Mountain (Tenn.) | Coordinates: 35.60954, -83.47794</subject_geographic>
        <subject_geographic>Bearpen Hollow (Tenn.) | Coordinates: 35.63648, -83.46266</subject_geographic>
        <subject_name>Smoky Mountains Hiking Club</subject_name>
        <project_title>Smoky Mountains Hiking Club Handbooks</project_title>
        <repository>University of Tennessee, Knoxville. Special Collections</repository>
        <rights>The copyright interests in this item remain with the creator. For more information, contact Special Collections at special@utk.edu.</rights>
        <public_note>Title is from information on back of photograph.</public_note>
        <public_note>Collection donated by Laura E. and Ella Luttrell</public_note>
        <digital_origin>reformatted digital</digital_origin>
        <item_type>still image</item_type>
    </row>
    <row>
        <identifier>HikingClub_photos_0038</identifier>
        <title>Chimney &amp; Indian Gap Hotel May 18-19-1929 (image number 259)</title>
        <date_text>5/18-19/1929</date_text>
        <date_single_start>1929-05-18</date_single_start>
        <date_range_end>1929-05-19</date_range_end>
        <collection>Smoky Mountains Hiking Club Records</collection>
        <collection_identifier>MS.0423</collection_identifier>
        <shelf_locator>Box 1</shelf_locator>
        <extent>3.5 x 5.75 inches</extent>
        <form>photographs | http://vocab.getty.edu/aat/300046300</form>
        <language>eng</language>
        <subject_geographic>Great Smoky Mountains | URI: http://id.loc.gov/authorities/subjects/sh85057008 | Coordinates: 35.58343, -83.50822</subject_geographic>
        <subject_geographic>Chimney Tops (Tenn.) | Coordinates: 35.62999, -83.47803</subject_geographic>
        <subject_geographic>Indian Gap Hotel</subject_geographic>
        <subject_name>Smoky Mountains Hiking Club</subject_name>
        <project_title>Smoky Mountains Hiking Club Handbooks</project_title>
        <repository>University of Tennessee, Knoxville. Special Collections</repository>
        <rights>The copyright interests in this item remain with the creator. For more information, contact Special Collections at special@utk.edu.</rights>
        <public_note>Title is from information on back of photograph.</public_note>
        <public_note>Collection donated by Laura E. and Ella Luttrell</public_note>
        <digital_origin>reformatted digital</digital_origin>
        <item_type>still image</item_type>
    </row>
    <row>
        <identifier>HikingClub_photos_0039</identifier>
        <title>West Prong Little Pigeon River near Chimneys May 18-19-1929. High Water on account Heavy Rains Reason we did not go to Huggins Hell (image number 261)</title>
        <date_text>5/18-19/1929</date_text>
        <date_single_start>1929-05-18</date_single_start>
        <date_range_end>1929-05-19</date_range_end>
        <collection>Smoky Mountains Hiking Club Records</collection>
        <collection_identifier>MS.0423</collection_identifier>
        <shelf_locator>Box 1</shelf_locator>
        <extent>3.5 x 5.75 inches</extent>
        <form>photographs | http://vocab.getty.edu/aat/300046300</form>
        <language>eng</language>
        <subject_geographic>Great Smoky Mountains | URI: http://id.loc.gov/authorities/subjects/sh85057008 | Coordinates: 35.58343, -83.50822</subject_geographic>
        <subject_geographic>Little Pigeon River (Tenn.)</subject_geographic>
        <subject_geographic>Chimney Tops (Tenn.) | Coordinates: 35.62999, -83.47803</subject_geographic>
        <subject_name>Smoky Mountains Hiking Club</subject_name>
        <project_title>Smoky Mountains Hiking Club Handbooks</project_title>
        <repository>University of Tennessee, Knoxville. Special Collections</repository>
        <rights>The copyright interests in this item remain with the creator. For more information, contact Special Collections at special@utk.edu.</rights>
        <public_note>Title is from information on back of photograph.</public_note>
        <public_note>Collection donated by Laura E. and Ella Luttrell</public_note>
        <digital_origin>reformatted digital</digital_origin>
        <item_type>still image</item_type>
    </row>
    <row>
        <identifier>HikingClub_photos_0041</identifier>
        <title>Falls on way to Guyot Aug 31 - Sept 1-2-1929 (image number 339)</title>
        <date_text>8/31-9/1-2/1929</date_text>
        <date_single_start>1929-08-31</date_single_start>
        <date_range_end>1929-09-02</date_range_end>
        <collection>Smoky Mountains Hiking Club Records</collection>
        <collection_identifier>MS.0423</collection_identifier>
        <shelf_locator>Box 1</shelf_locator>
        <extent>3.5 x 5.75 inches</extent>
        <form>photographs | http://vocab.getty.edu/aat/300046300</form>
        <language>eng</language>
        <subject_geographic>Great Smoky Mountains | URI: http://id.loc.gov/authorities/subjects/sh85057008 | Coordinates: 35.58343, -83.50822</subject_geographic>
        <subject_geographic>Guyot, Mount (Tenn.) | Coordinates: 35.705, -83.2575</subject_geographic>
        <subject_geographic>Ramsey Cascades (Tenn.) | Coordinates: 35.7085, -83.30003</subject_geographic>
        <subject_name>Smoky Mountains Hiking Club</subject_name>
        <project_title>Smoky Mountains Hiking Club Handbooks</project_title>
        <repository>University of Tennessee, Knoxville. Special Collections</repository>
        <rights>The copyright interests in this item remain with the creator. For more information, contact Special Collections at special@utk.edu.</rights>
        <public_note>Title is from information on back of photograph.</public_note>
        <public_note>Collection donated by Laura E. and Ella Luttrell</public_note>
        <digital_origin>reformatted digital</digital_origin>
        <item_type>still image</item_type>
    </row>
    <row>
        <identifier>HikingClub_photos_0042</identifier>
        <title>Falls on way to Guyot Aug 31 - Sept 1-2-1929 (image number 340)</title>
        <date_text>8/31-9/1-2/1929</date_text>
        <date_single_start>1929-08-31</date_single_start>
        <date_range_end>1929-09-02</date_range_end>
        <collection>Smoky Mountains Hiking Club Records</collection>
        <collection_identifier>MS.0423</collection_identifier>
        <shelf_locator>Box 1</shelf_locator>
        <extent>3.5 x 5.75 inches</extent>
        <form>photographs | http://vocab.getty.edu/aat/300046300</form>
        <language>eng</language>
        <subject_geographic>Great Smoky Mountains | URI: http://id.loc.gov/authorities/subjects/sh85057008 | Coordinates: 35.58343, -83.50822</subject_geographic>
        <subject_geographic>Guyot, Mount (Tenn.) | Coordinates: 35.705, -83.2575</subject_geographic>
        <subject_geographic>Ramsey Cascades (Tenn.) | Coordinates: 35.7085, -83.30003</subject_geographic>
        <subject_name>Smoky Mountains Hiking Club</subject_name>
        <project_title>Smoky Mountains Hiking Club Handbooks</project_title>
        <repository>University of Tennessee, Knoxville. Special Collections</repository>
        <rights>The copyright interests in this item remain with the creator. For more information, contact Special Collections at special@utk.edu.</rights>
        <public_note>Title is from information on back of photograph.</public_note>
        <public_note>Collection donated by Laura E. and Ella Luttrell</public_note>
        <digital_origin>reformatted digital</digital_origin>
        <item_type>still image</item_type>
    </row>
    <row>
        <identifier>HikingClub_photos_0043</identifier>
        <title>On way to Guyot Aug 31 - Sept 1-2-1929 (image number 342)</title>
        <date_text>8/31-9/1-2/1929</date_text>
        <date_single_start>1929-08-31</date_single_start>
        <date_range_end>1929-09-02</date_range_end>
        <collection>Smoky Mountains Hiking Club Records</collection>
        <collection_identifier>MS.0423</collection_identifier>
        <shelf_locator>Box 1</shelf_locator>
        <extent>3.5 x 5.75 inches</extent>
        <form>photographs | http://vocab.getty.edu/aat/300046300</form>
        <language>eng</language>
        <subject_geographic>Great Smoky Mountains | URI: http://id.loc.gov/authorities/subjects/sh85057008 | Coordinates: 35.58343, -83.50822</subject_geographic>
        <subject_geographic>Guyot, Mount (Tenn.) | Coordinates: 35.705, -83.2575</subject_geographic>
        <subject_name>Smoky Mountains Hiking Club</subject_name>
        <project_title>Smoky Mountains Hiking Club Handbooks</project_title>
        <repository>University of Tennessee, Knoxville. Special Collections</repository>
        <rights>The copyright interests in this item remain with the creator. For more information, contact Special Collections at special@utk.edu.</rights>
        <public_note>Title is from information on back of photograph.</public_note>
        <public_note>Collection donated by Laura E. and Ella Luttrell</public_note>
        <digital_origin>reformatted digital</digital_origin>
        <item_type>still image</item_type>
    </row>
    <row>
        <identifier>HikingClub_photos_0044</identifier>
        <title>Spending night near Guyot Aug 31 - Sept 1 + 2, 1929 (image number 341)</title>
        <abstract>Albert "Dutch" Roth in foreground</abstract>
        <date_text>8/31-9/1-2/1929</date_text>
        <date_single_start>1929-08-31</date_single_start>
        <date_range_end>1929-09-02</date_range_end>
        <collection>Smoky Mountains Hiking Club Records</collection>
        <collection_identifier>MS.0423</collection_identifier>
        <shelf_locator>Box 1</shelf_locator>
        <extent>3.5 x 5.75 inches</extent>
        <form>photographs | http://vocab.getty.edu/aat/300046300</form>
        <language>eng</language>
        <subject_geographic>Great Smoky Mountains | URI: http://id.loc.gov/authorities/subjects/sh85057008 | Coordinates: 35.58343, -83.50822</subject_geographic>
        <subject_geographic>Guyot, Mount (Tenn.) | Coordinates: 35.705, -83.2575</subject_geographic>
        <subject_name>Smoky Mountains Hiking Club</subject_name>
        <project_title>Smoky Mountains Hiking Club Handbooks</project_title>
        <repository>University of Tennessee, Knoxville. Special Collections</repository>
        <rights>The copyright interests in this item remain with the creator. For more information, contact Special Collections at special@utk.edu.</rights>
        <public_note>Title is from information on back of photograph.</public_note>
        <public_note>Collection donated by Laura E. and Ella Luttrell</public_note>
        <digital_origin>reformatted digital</digital_origin>
        <item_type>still image</item_type>
    </row>
    <row>
        <identifier>HikingClub_photos_0045</identifier>
        <title>View from Guyot Aug 31 - Sept 1-2-1929 (image number 343)</title>
        <date_text>8/31-9/1-2/1929</date_text>
        <date_single_start>1929-08-31</date_single_start>
        <date_range_end>1929-09-02</date_range_end>
        <collection>Smoky Mountains Hiking Club Records</collection>
        <collection_identifier>MS.0423</collection_identifier>
        <shelf_locator>Box 1</shelf_locator>
        <extent>3.5 x 5.75 inches</extent>
        <form>photographs | http://vocab.getty.edu/aat/300046300</form>
        <language>eng</language>
        <subject_geographic>Great Smoky Mountains | URI: http://id.loc.gov/authorities/subjects/sh85057008 | Coordinates: 35.58343, -83.50822</subject_geographic>
        <subject_geographic>Guyot, Mount (Tenn.) | Coordinates: 35.705, -83.2575</subject_geographic>
        <subject_name>Smoky Mountains Hiking Club</subject_name>
        <project_title>Smoky Mountains Hiking Club Handbooks</project_title>
        <repository>University of Tennessee, Knoxville. Special Collections</repository>
        <rights>The copyright interests in this item remain with the creator. For more information, contact Special Collections at special@utk.edu.</rights>
        <public_note>Title is from information on back of photograph.</public_note>
        <public_note>Collection donated by Laura E. and Ella Luttrell</public_note>
        <digital_origin>reformatted digital</digital_origin>
        <item_type>still image</item_type>
    </row>
    <row>
        <identifier>HikingClub_photos_0046</identifier>
        <title>View from Guyot Aug 31 - Sept 1-2-1929 (image number 344)</title>
        <date_text>8/31-9/1-2/1929</date_text>
        <date_single_start>1929-08-31</date_single_start>
        <date_range_end>1929-09-02</date_range_end>
        <collection>Smoky Mountains Hiking Club Records</collection>
        <collection_identifier>MS.0423</collection_identifier>
        <shelf_locator>Box 1</shelf_locator>
        <extent>3.5 x 5.75 inches</extent>
        <form>photographs | http://vocab.getty.edu/aat/300046300</form>
        <language>eng</language>
        <subject_geographic>Great Smoky Mountains | URI: http://id.loc.gov/authorities/subjects/sh85057008 | Coordinates: 35.58343, -83.50822</subject_geographic>
        <subject_geographic>Guyot, Mount (Tenn.) | Coordinates: 35.705, -83.2575</subject_geographic>
        <subject_name>Smoky Mountains Hiking Club</subject_name>
        <project_title>Smoky Mountains Hiking Club Handbooks</project_title>
        <repository>University of Tennessee, Knoxville. Special Collections</repository>
        <rights>The copyright interests in this item remain with the creator. For more information, contact Special Collections at special@utk.edu.</rights>
        <public_note>Title is from information on back of photograph.</public_note>
        <public_note>Collection donated by Laura E. and Ella Luttrell</public_note>
        <digital_origin>reformatted digital</digital_origin>
        <item_type>still image</item_type>
    </row>
    <row>
        <identifier>HikingClub_photos_0047</identifier>
        <title>Pinnacle at Greenbrier Aug 31 - Sept 1-2-1929 (image number 345)</title>
        <date_text>8/31-9/1-2/1929</date_text>
        <date_single_start>1929-08-31</date_single_start>
        <date_range_end>1929-09-02</date_range_end>
        <collection>Smoky Mountains Hiking Club Records</collection>
        <collection_identifier>MS.0423</collection_identifier>
        <shelf_locator>Box 1</shelf_locator>
        <extent>3.5 x 5.75 inches</extent>
        <form>photographs | http://vocab.getty.edu/aat/300046300</form>
        <language>eng</language>
        <subject_geographic>Great Smoky Mountains | URI: http://id.loc.gov/authorities/subjects/sh85057008 | Coordinates: 35.58343, -83.50822</subject_geographic>
        <subject_geographic>Greenbrier Pinnacle (Tenn.) | Coordinates: 35.72287, -83.31599</subject_geographic>
        <subject_geographic>Greenbrier (Sevier County, Tenn.) | URI: http://id.loc.gov/authorities/names/n85332882 | Coordinates: 35.68342, -83.6385</subject_geographic>
        <subject_name>Smoky Mountains Hiking Club</subject_name>
        <project_title>Smoky Mountains Hiking Club Handbooks</project_title>
        <repository>University of Tennessee, Knoxville. Special Collections</repository>
        <rights>The copyright interests in this item remain with the creator. For more information, contact Special Collections at special@utk.edu.</rights>
        <public_note>Title is from information on back of photograph.</public_note>
        <public_note>Collection donated by Laura E. and Ella Luttrell</public_note>
        <digital_origin>reformatted digital</digital_origin>
        <item_type>still image</item_type>
    </row>
    <row>
        <identifier>HikingClub_photos_0048</identifier>
        <title>Crossing river at Greenbrier on way back from Guyot Aug 31 - Sept 1-2-1929 (image number 346)</title>
        <date_text>8/31-9/1-2/1929</date_text>
        <date_single_start>1929-08-31</date_single_start>
        <date_range_end>1929-09-02</date_range_end>
        <collection>Smoky Mountains Hiking Club Records</collection>
        <collection_identifier>MS.0423</collection_identifier>
        <shelf_locator>Box 1</shelf_locator>
        <extent>3.5 x 5.75 inches</extent>
        <form>photographs | http://vocab.getty.edu/aat/300046300</form>
        <language>eng</language>
        <subject_geographic>Great Smoky Mountains | URI: http://id.loc.gov/authorities/subjects/sh85057008 | Coordinates: 35.58343, -83.50822</subject_geographic>
        <subject_geographic>West Prong of Little Pigeon River (Tenn.) | Coordinates: 35.87398, -83.57267</subject_geographic>
        <subject_geographic>Greenbrier (Sevier County, Tenn.) | URI: http://id.loc.gov/authorities/names/n85332882 | Coordinates: 35.68342, -83.6385</subject_geographic>
        <subject_name>Smoky Mountains Hiking Club</subject_name>
        <project_title>Smoky Mountains Hiking Club Handbooks</project_title>
        <repository>University of Tennessee, Knoxville. Special Collections</repository>
        <rights>The copyright interests in this item remain with the creator. For more information, contact Special Collections at special@utk.edu.</rights>
        <public_note>Title is from information on back of photograph.</public_note>
        <public_note>Collection donated by Laura E. and Ella Luttrell</public_note>
        <digital_origin>reformatted digital</digital_origin>
        <item_type>still image</item_type>
    </row>
    <row>
        <identifier>HikingClub_photos_0049</identifier>
        <title>Chestnut Tree on way to Guyot. Over 20 ft. in circumference. Aug 31 - Sept 1-2-1929 (image number 348)</title>
        <date_text>8/31-9/1-2/1929</date_text>
        <date_single_start>1929-08-31</date_single_start>
        <date_range_end>1929-09-02</date_range_end>
        <collection>Smoky Mountains Hiking Club Records</collection>
        <collection_identifier>MS.0423</collection_identifier>
        <shelf_locator>Box 1</shelf_locator>
        <extent>3.5 x 5.75 inches</extent>
        <form>photographs | http://vocab.getty.edu/aat/300046300</form>
        <language>eng</language>
        <subject_geographic>Great Smoky Mountains | URI: http://id.loc.gov/authorities/subjects/sh85057008 | Coordinates: 35.58343, -83.50822</subject_geographic>
        <subject_geographic>Greenbrier (Sevier County, Tenn.) | URI: http://id.loc.gov/authorities/names/n85332882 | Coordinates: 35.68342, -83.6385</subject_geographic>
        <subject_name>Smoky Mountains Hiking Club</subject_name>
        <project_title>Smoky Mountains Hiking Club Handbooks</project_title>
        <repository>University of Tennessee, Knoxville. Special Collections</repository>
        <rights>The copyright interests in this item remain with the creator. For more information, contact Special Collections at special@utk.edu.</rights>
        <public_note>Title is from information on back of photograph.</public_note>
        <public_note>Collection donated by Laura E. and Ella Luttrell</public_note>
        <digital_origin>reformatted digital</digital_origin>
        <item_type>still image</item_type>
    </row>
    <row>
        <identifier>HikingClub_photos_0050</identifier>
        <title>Bird Reserve Installation of Officers Dec 15-1929</title>
        <date_text>12/15/1929</date_text>
        <date_single_start>1929-12-15</date_single_start>
        <collection>Smoky Mountains Hiking Club Records</collection>
        <collection_identifier>MS.0423</collection_identifier>
        <shelf_locator>Box 1</shelf_locator>
        <extent>3.5 x 5.75 inches</extent>
        <form>photographs | http://vocab.getty.edu/aat/300046300</form>
        <language>eng</language>
        <subject_geographic>Great Smoky Mountains | URI: http://id.loc.gov/authorities/subjects/sh85057008 | Coordinates: 35.58343, -83.50822</subject_geographic>
        <subject_name>Smoky Mountains Hiking Club</subject_name>
        <project_title>Smoky Mountains Hiking Club Handbooks</project_title>
        <repository>University of Tennessee, Knoxville. Special Collections</repository>
        <rights>The copyright interests in this item remain with the creator. For more information, contact Special Collections at special@utk.edu.</rights>
        <public_note>Title is from information on back of photograph. Unable to read image number on photograph.</public_note>
        <public_note>Collection donated by Laura E. and Ella Luttrell</public_note>
        <digital_origin>reformatted digital</digital_origin>
        <item_type>still image</item_type>
    </row>
    <row>
        <identifier>HikingClub_photos_0052</identifier>
        <title>On trail to Mt. Nebo Jan 12-1930 (image number 403)</title>
        <date_text>1/12/1930</date_text>
        <date_single_start>1930-01-12</date_single_start>
        <collection>Smoky Mountains Hiking Club Records</collection>
        <collection_identifier>MS.0423</collection_identifier>
        <shelf_locator>Box 1</shelf_locator>
        <extent>3.5 x 5.75 inches</extent>
        <form>photographs | http://vocab.getty.edu/aat/300046300</form>
        <language>eng</language>
        <subject_geographic>Great Smoky Mountains | URI: http://id.loc.gov/authorities/subjects/sh85057008 | Coordinates: 35.58343, -83.50822</subject_geographic>
        <subject_geographic>Nebo, Mount (Tenn.) | Coordinates: 35.72897, -83.8299</subject_geographic>
        <subject_name>Smoky Mountains Hiking Club</subject_name>
        <project_title>Smoky Mountains Hiking Club Handbooks</project_title>
        <repository>University of Tennessee, Knoxville. Special Collections</repository>
        <rights>The copyright interests in this item remain with the creator. For more information, contact Special Collections at special@utk.edu.</rights>
        <public_note>Title is from information on back of photograph.</public_note>
        <public_note>Collection donated by Laura E. and Ella Luttrell</public_note>
        <digital_origin>reformatted digital</digital_origin>
        <item_type>still image</item_type>
    </row>
    <row>
        <identifier>HikingClub_photos_0053</identifier>
        <title>Club Leaving Cars for Mt. Nebo Jan 12-1930 (image number 406)</title>
        <date_text>1/12/1930</date_text>
        <date_single_start>1930-01-12</date_single_start>
        <collection>Smoky Mountains Hiking Club Records</collection>
        <collection_identifier>MS.0423</collection_identifier>
        <shelf_locator>Box 1</shelf_locator>
        <extent>3.5 x 5.75 inches</extent>
        <form>photographs | http://vocab.getty.edu/aat/300046300</form>
        <language>eng</language>
        <subject_geographic>Great Smoky Mountains | URI: http://id.loc.gov/authorities/subjects/sh85057008 | Coordinates: 35.58343, -83.50822</subject_geographic>
        <subject_geographic>Nebo, Mount (Tenn.) | Coordinates: 35.72897, -83.8299</subject_geographic>
        <subject_name>Smoky Mountains Hiking Club</subject_name>
        <project_title>Smoky Mountains Hiking Club Handbooks</project_title>
        <repository>University of Tennessee, Knoxville. Special Collections</repository>
        <rights>The copyright interests in this item remain with the creator. For more information, contact Special Collections at special@utk.edu.</rights>
        <public_note>Title is from information on back of photograph.</public_note>
        <public_note>Collection donated by Laura E. and Ella Luttrell</public_note>
        <digital_origin>reformatted digital</digital_origin>
        <item_type>still image</item_type>
    </row>
    <row>
        <identifier>HikingClub_photos_0054</identifier>
        <title>Club Leaving for Mt. Nebo Jan 12-1930 (image number 401)</title>
        <date_text>1/12/1930</date_text>
        <date_single_start>1930-01-12</date_single_start>
        <collection>Smoky Mountains Hiking Club Records</collection>
        <collection_identifier>MS.0423</collection_identifier>
        <shelf_locator>Box 1</shelf_locator>
        <extent>3.5 x 5.75 inches</extent>
        <form>photographs | http://vocab.getty.edu/aat/300046300</form>
        <language>eng</language>
        <subject_geographic>Great Smoky Mountains | URI: http://id.loc.gov/authorities/subjects/sh85057008 | Coordinates: 35.58343, -83.50822</subject_geographic>
        <subject_geographic>Nebo, Mount (Tenn.) | Coordinates: 35.72897, -83.8299</subject_geographic>
        <subject_name>Smoky Mountains Hiking Club</subject_name>
        <project_title>Smoky Mountains Hiking Club Handbooks</project_title>
        <repository>University of Tennessee, Knoxville. Special Collections</repository>
        <rights>The copyright interests in this item remain with the creator. For more information, contact Special Collections at special@utk.edu.</rights>
        <public_note>Title is from information on back of photograph.</public_note>
        <public_note>Collection donated by Laura E. and Ella Luttrell</public_note>
        <digital_origin>reformatted digital</digital_origin>
        <item_type>still image</item_type>
    </row>
    <row>
        <identifier>HikingClub_photos_0055</identifier>
        <title>Bird Reserve Dec 15-1930 (image number 619)</title>
        <abstract>Albert "Dutch" Roth in front, second from left</abstract>
        <date_text>12/15/1930</date_text>
        <date_single_start>1930-12-15</date_single_start>
        <collection>Smoky Mountains Hiking Club Records</collection>
        <collection_identifier>MS.0423</collection_identifier>
        <shelf_locator>Box 1</shelf_locator>
        <extent>3.5 x 5.75 inches</extent>
        <form>photographs | http://vocab.getty.edu/aat/300046300</form>
        <language>eng</language>
        <subject_geographic>Great Smoky Mountains | URI: http://id.loc.gov/authorities/subjects/sh85057008 | Coordinates: 35.58343, -83.50822</subject_geographic>
        <subject_name>Smoky Mountains Hiking Club</subject_name>
        <project_title>Smoky Mountains Hiking Club Handbooks</project_title>
        <repository>University of Tennessee, Knoxville. Special Collections</repository>
        <rights>The copyright interests in this item remain with the creator. For more information, contact Special Collections at special@utk.edu.</rights>
        <public_note>Title is from information on back of photograph.</public_note>
        <public_note>Collection donated by Laura E. and Ella Luttrell</public_note>
        <digital_origin>reformatted digital</digital_origin>
        <item_type>still image</item_type>
    </row>
    <row>
        <identifier>HikingClub_photos_0056</identifier>
        <title>View of Mts. in North Carolina from State Line between Deal Gap &amp; Parson Bald Feb 1-1931 (image number 666)</title>
        <date_text>2/1/1931</date_text>
        <date_single_start>1931-02-01</date_single_start>
        <collection>Smoky Mountains Hiking Club Records</collection>
        <collection_identifier>MS.0423</collection_identifier>
        <shelf_locator>Box 1</shelf_locator>
        <extent>3.5 x 5.75 inches</extent>
        <form>photographs | http://vocab.getty.edu/aat/300046300</form>
        <language>eng</language>
        <subject_geographic>Great Smoky Mountains | URI: http://id.loc.gov/authorities/subjects/sh85057008 | Coordinates: 35.58343, -83.50822</subject_geographic>
        <subject_geographic>Deals Gap (Tenn.) | Coordinates: 35.47425, -83.91546</subject_geographic>
        <subject_geographic>Parson Bald (Tenn.) | Coordinates: 35.51592, -83.88268</subject_geographic>
        <subject_name>Smoky Mountains Hiking Club</subject_name>
        <project_title>Smoky Mountains Hiking Club Handbooks</project_title>
        <repository>University of Tennessee, Knoxville. Special Collections</repository>
        <rights>The copyright interests in this item remain with the creator. For more information, contact Special Collections at special@utk.edu.</rights>
        <public_note>Title is from information on back of photograph.</public_note>
        <public_note>Collection donated by Laura E. and Ella Luttrell</public_note>
        <digital_origin>reformatted digital</digital_origin>
        <item_type>still image</item_type>
    </row>
    <row>
        <identifier>HikingClub_photos_0057</identifier>
        <title>On top of Gregory Bald Feb 15-1931 (image number 664)</title>
        <date_text>2/15/1931</date_text>
        <date_single_start>1931-02-15</date_single_start>
        <collection>Smoky Mountains Hiking Club Records</collection>
        <collection_identifier>MS.0423</collection_identifier>
        <shelf_locator>Box 1</shelf_locator>
        <extent>3.5 x 5.75 inches</extent>
        <form>photographs | http://vocab.getty.edu/aat/300046300</form>
        <language>eng</language>
        <subject_geographic>Great Smoky Mountains | URI: http://id.loc.gov/authorities/subjects/sh85057008 | Coordinates: 35.58343, -83.50822</subject_geographic>
        <subject_geographic>Gregory Bald (Tenn.) | Coordinates: 35.52064, -83.86601</subject_geographic>
        <subject_name>Smoky Mountains Hiking Club</subject_name>
        <project_title>Smoky Mountains Hiking Club Handbooks</project_title>
        <repository>University of Tennessee, Knoxville. Special Collections</repository>
        <rights>The copyright interests in this item remain with the creator. For more information, contact Special Collections at special@utk.edu.</rights>
        <public_note>Title is from information on back of photograph.</public_note>
        <public_note>Collection donated by Laura E. and Ella Luttrell</public_note>
        <digital_origin>reformatted digital</digital_origin>
        <item_type>still image</item_type>
    </row>
    <row>
        <identifier>HikingClub_photos_0058</identifier>
        <title>View of Calderwood Dam with Mt. of North Carolina in background taken from state Highway on way to Deal Gap. Feb 15-1931 (image number 665)</title>
        <date_text>2/15/1931</date_text>
        <date_single_start>1931-02-15</date_single_start>
        <collection>Smoky Mountains Hiking Club Records</collection>
        <collection_identifier>MS.0423</collection_identifier>
        <shelf_locator>Box 1</shelf_locator>
        <extent>3.5 x 5.75 inches</extent>
        <form>photographs | http://vocab.getty.edu/aat/300046300</form>
        <language>eng</language>
        <subject_geographic>Great Smoky Mountains | URI: http://id.loc.gov/authorities/subjects/sh85057008 | Coordinates: 35.58343, -83.50822</subject_geographic>
        <subject_geographic>Calderwood Dam (Tenn.) | Coordinates: 35.49258, -83.97935</subject_geographic>
        <subject_geographic>Deals Gap (Tenn.) | Coordinates: 35.47425, -83.91546</subject_geographic>
        <subject_geographic>TN Highway 129</subject_geographic>
        <subject_name>Smoky Mountains Hiking Club</subject_name>
        <project_title>Smoky Mountains Hiking Club Handbooks</project_title>
        <repository>University of Tennessee, Knoxville. Special Collections</repository>
        <rights>The copyright interests in this item remain with the creator. For more information, contact Special Collections at special@utk.edu.</rights>
        <public_note>Title is from information on back of photograph.</public_note>
        <public_note>Collection donated by Laura E. and Ella Luttrell</public_note>
        <digital_origin>reformatted digital</digital_origin>
        <item_type>still image</item_type>
    </row>
    <row>
        <identifier>HikingClub_photos_0059</identifier>
        <title>View of State Line from Gregory Bald Feb 15-1931 (image number 667)</title>
        <date_text>2/15/1931</date_text>
        <date_single_start>1931-02-15</date_single_start>
        <collection>Smoky Mountains Hiking Club Records</collection>
        <collection_identifier>MS.0423</collection_identifier>
        <shelf_locator>Box 1</shelf_locator>
        <extent>3.5 x 5.75 inches</extent>
        <form>photographs | http://vocab.getty.edu/aat/300046300</form>
        <language>eng</language>
        <subject_geographic>Great Smoky Mountains | URI: http://id.loc.gov/authorities/subjects/sh85057008 | Coordinates: 35.58343, -83.50822</subject_geographic>
        <subject_geographic>Gregory Bald (Tenn.) | Coordinates: 35.52064, -83.86601</subject_geographic>
        <subject_name>Smoky Mountains Hiking Club</subject_name>
        <project_title>Smoky Mountains Hiking Club Handbooks</project_title>
        <repository>University of Tennessee, Knoxville. Special Collections</repository>
        <rights>The copyright interests in this item remain with the creator. For more information, contact Special Collections at special@utk.edu.</rights>
        <public_note>Title is from information on back of photograph.</public_note>
        <public_note>Collection donated by Laura E. and Ella Luttrell</public_note>
        <digital_origin>reformatted digital</digital_origin>
        <item_type>still image</item_type>
    </row>
    <row>
        <identifier>HikingClub_photos_0060</identifier>
        <title>View of Mt. in North Carolina from Gregory Bald Feb 15-1931 (image number 668)</title>
        <date_text>2/15/1931</date_text>
        <date_single_start>1931-02-15</date_single_start>
        <collection>Smoky Mountains Hiking Club Records</collection>
        <collection_identifier>MS.0423</collection_identifier>
        <shelf_locator>Box 1</shelf_locator>
        <extent>3.5 x 5.75 inches</extent>
        <form>photographs | http://vocab.getty.edu/aat/300046300</form>
        <language>eng</language>
        <subject_geographic>Great Smoky Mountains | URI: http://id.loc.gov/authorities/subjects/sh85057008 | Coordinates: 35.58343, -83.50822</subject_geographic>
        <subject_geographic>Gregory Bald (Tenn.) | Coordinates: 35.52064, -83.86601</subject_geographic>
        <subject_name>Smoky Mountains Hiking Club</subject_name>
        <project_title>Smoky Mountains Hiking Club Handbooks</project_title>
        <repository>University of Tennessee, Knoxville. Special Collections</repository>
        <rights>The copyright interests in this item remain with the creator. For more information, contact Special Collections at special@utk.edu.</rights>
        <public_note>Title is from information on back of photograph.</public_note>
        <public_note>Collection donated by Laura E. and Ella Luttrell</public_note>
        <digital_origin>reformatted digital</digital_origin>
        <item_type>still image</item_type>
    </row>
    <row>
        <identifier>HikingClub_photos_0061</identifier>
        <title>Looking in North Carolina from Gregory Bald Feb 1-1931 (image 669)</title>
        <date_text>2/1/1931</date_text>
        <date_single_start>1931-02-01</date_single_start>
        <collection>Smoky Mountains Hiking Club Records</collection>
        <collection_identifier>MS.0423</collection_identifier>
        <shelf_locator>Box 1</shelf_locator>
        <extent>3.5 x 5.75 inches</extent>
        <form>photographs | http://vocab.getty.edu/aat/300046300</form>
        <language>eng</language>
        <subject_geographic>Great Smoky Mountains | URI: http://id.loc.gov/authorities/subjects/sh85057008 | Coordinates: 35.58343, -83.50822</subject_geographic>
        <subject_geographic>Gregory Bald (Tenn.) | Coordinates: 35.52064, -83.86601</subject_geographic>
        <subject_name>Smoky Mountains Hiking Club</subject_name>
        <project_title>Smoky Mountains Hiking Club Handbooks</project_title>
        <repository>University of Tennessee, Knoxville. Special Collections</repository>
        <rights>The copyright interests in this item remain with the creator. For more information, contact Special Collections at special@utk.edu.</rights>
        <public_note>Title is from information on back of photograph.</public_note>
        <public_note>Collection donated by Laura E. and Ella Luttrell</public_note>
        <digital_origin>reformatted digital</digital_origin>
        <item_type>still image</item_type>
    </row>
    <row>
        <identifier>HikingClub_photos_0062</identifier>
